{
  "schemaVersion": 1,
  "contractId": "relay-attempt-result",
  "attemptId": "attempt-raw-1",
  "fixtureId": "tokens-27000-vocab-8000",
  "strategyId": "raw-utf8",
  "status": "failed-attack",
  "accessedInputs": [],
  "transactions": [],
  "frameDigests": [],
  "frameBytes": "0",
  "separateCapacityBits": "120",
  "decodedOutput": null,
  "exactReconstruction": false,
  "failureCode": "incomplete-reconstruction"
}
